{
  "knowledge_id": "forge-knowledge:nozzle-primary-040",
  "knowledge_type": "fact",
  "subject_id": "community-device:garage-printer",
  "predicate": "has_nozzle_diameter_mm",
  "value": 0.4,
  "scope": "installation:local",
  "confidence": 0.98,
  "source_class": "user_confirmation",
  "source_refs": ["forge-evidence:nozzle-inspection-001"],
  "origin": "local",
  "created_at": "2026-07-25T20:00:00Z",
  "updated_at": "2026-07-25T20:00:00Z",
  "last_verified_at": "2026-07-25T20:00:00Z",
  "expires_at": null,
  "status": "active",
  "requires_verification": false,
  "depends_on": [],
  "supersedes": null,
  "superseded_by": null,
  "reason": "user_confirmed_measurement"
}
